{
  "schema_version": "unirouter.completed-execution.v1",
  "request_id": "req_feed_v1_settled",
  "org_id": 101,
  "project_id": 202,
  "terminal": {
    "status": "settled",
    "available_at": "2026-07-25T04:05:06Z"
  },
  "usage": {
    "model": "synthetic-model",
    "prompt_tokens": 8,
    "uncached_prompt_tokens": 5,
    "cache_read_tokens": 2,
    "cache_creation_tokens": 1,
    "completion_tokens": 3,
    "source": "provider",
    "authority": "provider",
    "purpose": "billing",
    "finality": "final",
    "contract_version": "usage.v1",
    "cache_usage_schema": "cache.v1",
    "cache_usage_status": "reported"
  },
  "money": {
    "schema": "micro-cny.v1",
    "currency": "CNY",
    "amount_scale": 1000000,
    "calculated_cost_micros": "17",
    "charged_cost_micros": "17",
    "pricing_version": "pricing-v1"
  },
  "capture_gaps": [
    {"source": "call_log", "reason": "not_available_at_billing_terminal"},
    {"source": "request_trace", "reason": "not_available_at_billing_terminal"},
    {"source": "client_ip_presence", "reason": "not_available_at_billing_terminal"},
    {"source": "upstream_error_presence", "reason": "not_available_at_billing_terminal"}
  ]
}
